Park_Code,Name,Designation,States,Latitude,Longitude,Description,URL,Country,UNESCO_Year
BOROBUDUR,Borobudur Temple Compounds,UNESCO World Heritage Site (Cultural),Central Java,-7.6081,110.2044,"Borobudur Temple Compounds - UNESCO World Heritage Site. 9th-century Mahayana Buddhist temple, one of the largest Buddhist temples in the world.",https://whc.unesco.org/en/list/592,Indonesia,1991
PRAMBANAN,Prambanan Temple Compounds,UNESCO World Heritage Site (Cultural),"Central Java, Yogyakarta",-7.7520,110.4915,Prambanan Temple Compounds - UNESCO World Heritage Site. 9th-century Hindu temple complex dedicated to Trimurti.,https://whc.unesco.org/en/list/642,Indonesia,1991
SANGIRAN,Sangiran Early Man Site,UNESCO World Heritage Site (Cultural),Central Java,-7.4500,110.8333,Sangiran Early Man Site - UNESCO World Heritage Site. Archaeological site with important hominid fossils.,https://whc.unesco.org/en/list/593,Indonesia,1996
BALI,Cultural Landscape of Bali Province,UNESCO World Heritage Site (Cultural),Bali,-8.3405,115.0920,Cultural Landscape of Bali Province - UNESCO World Heritage Site. Subak system of water management and rice terraces.,https://whc.unesco.org/en/list/1194,Indonesia,2012
OMBILLIN,Ombilin Coal Mining Heritage of Sawahlunto,UNESCO World Heritage Site (Cultural),West Sumatra,-0.6833,100.7833,Ombilin Coal Mining Heritage - UNESCO World Heritage Site. Industrial heritage of coal mining in Indonesia.,https://whc.unesco.org/en/list/1610,Indonesia,2019
UJUNG,Ujung Kulon National Park,UNESCO World Heritage Site (Natural),"Banten, Lampung",-6.7833,105.3667,Ujung Kulon National Park - UNESCO World Heritage Site. Last remaining natural habitat of Javan rhinoceros.,https://whc.unesco.org/en/list/608,Indonesia,1991
KOMODO,Komodo National Park,UNESCO World Heritage Site (Natural),East Nusa Tenggara,-8.5500,119.4500,"Komodo National Park - UNESCO World Heritage Site. Home to the Komodo dragon, the world's largest lizard.",https://whc.unesco.org/en/list/609,Indonesia,1991
LORENTZ,Lorentz National Park,UNESCO World Heritage Site (Natural),Papua,-4.7500,137.8333,Lorentz National Park - UNESCO World Heritage Site. Largest protected area in Southeast Asia with diverse ecosystems.,https://whc.unesco.org/en/list/955,Indonesia,1999
SUMATRA,Tropical Rainforest Heritage of Sumatra,UNESCO World Heritage Site (Natural),"Aceh, North Sumatra, West Sumatra, Jambi, Bengkulu, South Sumatra",-0.5000,101.0000,Tropical Rainforest Heritage of Sumatra - UNESCO World Heritage Site. Three national parks with diverse flora and fauna.,https://whc.unesco.org/en/list/1167,Indonesia,2004
