Park_Code,Name,Designation,States,Latitude,Longitude,Description,URL,Country,UNESCO_Year
TAXILA,Taxila,UNESCO World Heritage Site (Cultural),Punjab,33.7500,72.8333,Taxila - UNESCO World Heritage Site. Ancient archaeological site with ruins from multiple civilizations including Gandhara.,https://whc.unesco.org/en/list/139,Pakistan,1980
MOENJODARO,Archaeological Ruins at Moenjodaro,UNESCO World Heritage Site (Cultural),Sindh,27.3292,68.1389,Archaeological Ruins at Moenjodaro - UNESCO World Heritage Site. Best preserved urban ruins of the Indus Valley Civilization.,https://whc.unesco.org/en/list/138,Pakistan,1980
LAHORE,Fort and Shalimar Gardens in Lahore,UNESCO World Heritage Site (Cultural),Punjab,31.5889,74.3153,Fort and Shalimar Gardens in Lahore - UNESCO World Heritage Site. Mughal fort and gardens from the 16th-17th centuries.,https://whc.unesco.org/en/list/171,Pakistan,1981
MAKLI,"Historical Monuments at Makli, Thatta",UNESCO World Heritage Site (Cultural),Sindh,24.7500,67.9000,"Historical Monuments at Makli, Thatta - UNESCO World Heritage Site. Vast necropolis with tombs and monuments from 14th-18th centuries.",https://whc.unesco.org/en/list/143,Pakistan,1981
ROHTAS,Rohtas Fort,UNESCO World Heritage Site (Cultural),Punjab,32.9667,73.5833,"Rohtas Fort - UNESCO World Heritage Site. 16th-century fortress built by Sher Shah Suri, never conquered.",https://whc.unesco.org/en/list/586,Pakistan,1997
TAKHT,Buddhist Ruins of Takht-i-Bahi and Neighbouring City Remains at Sahr-i-Bahlol,UNESCO World Heritage Site (Cultural),Khyber Pakhtunkhwa,34.2833,71.9500,Buddhist Ruins of Takht-i-Bahi - UNESCO World Heritage Site. Well-preserved Buddhist monastery complex from 1st century CE.,https://whc.unesco.org/en/list/140,Pakistan,1980
